{
  "$schema": "https://json-schema.org/draft/2020-12/schema", "title": "Oracle Lab Post-Integration Context", "type": "object", "additionalProperties": false,
  "required": ["schema_version", "context_kind", "generated_at", "expires_at", "manifest_digest", "command_results_digest", "registry_digest", "claims_digest", "repositories", "command_evidence", "disabled_capabilities", "next_phase_gates"],
  "properties": {
    "schema_version": {"const": 1}, "context_kind": {"const": "post_integration_context"}, "generated_at": {"type": "string", "format": "date-time"}, "expires_at": {"type": "string", "format": "date-time"},
    "manifest_digest": {"$ref": "#/$defs/digest"}, "command_results_digest": {"$ref": "#/$defs/digest"}, "registry_digest": {"$ref": "#/$defs/digest"}, "claims_digest": {"$ref": "#/$defs/digest"},
    "repositories": {"type": "array", "minItems": 2, "maxItems": 2, "prefixItems": [
      {"type": "object", "additionalProperties": false, "required": ["name", "commit", "remote_ref"], "properties": {"name": {"const": "cc_gateway"}, "commit": {"const": "b38198763ab7e337321e3a0d9e545375d3fb3ad0"}, "remote_ref": {"const": "refs/remotes/muqihang/main"}}},
      {"type": "object", "additionalProperties": false, "required": ["name", "commit", "remote_ref"], "properties": {"name": {"const": "sub2api"}, "commit": {"const": "d5a42bbd24d15af2ce7646d050a5ae5c77911d4f"}, "remote_ref": {"const": "refs/remotes/muqihang/main"}}}
    ], "items": false},
    "command_evidence": {"type": "array", "minItems": 8, "maxItems": 8, "items": {"type": "object", "additionalProperties": false, "required": ["command_id", "status", "result_digest"], "properties": {"command_id": {"enum": ["cc-build", "cc-test", "cc-cross-repo-baseline", "sidecar-test", "sub2api-test", "cc-b4-b6-red", "sidecar-b4-b6-red", "sub2api-b1-b3-red"]}, "status": {"enum": ["pass", "expected_fail"]}, "result_digest": {"$ref": "#/$defs/digest"}}}},
    "disabled_capabilities": {"type": "array", "minItems": 1, "uniqueItems": true, "items": {"type": "string"}}, "next_phase_gates": {"type": "array", "minItems": 1, "uniqueItems": true, "items": {"type": "string"}}
  }, "$defs": {"digest": {"type": "string", "pattern": "^sha256:[0-9a-f]{64}$"}}
}
