{"claims_digest":"sha256:b389c3655641f990bd7e31e9a176576f9664b7620ae90c5829a21dc9ff087943","command_evidence":[{"command_id":"cc-b4-b6-red","result_digest":"sha256:6d64b8992f3f08232437ae07942627e22988e7870cf942d080a436bfce8006c2","status":"expected_fail"},{"command_id":"cc-build","result_digest":"sha256:fa693ab844ab42c179c089707c46f7f18c99ad6ef8994b701b10b8203c2219fa","status":"pass"},{"command_id":"cc-cross-repo-baseline","result_digest":"sha256:af09e9e5f8d3c9aba00cc1ac0410a4afeeac3d3c5b2a9c7b5b098172829a5e30","status":"pass"},{"command_id":"cc-test","result_digest":"sha256:778598666800b862f1178644b59c0e69b6d05d4e7f9c5ee00410cf9a51ef41e5","status":"pass"},{"command_id":"sidecar-b4-b6-red","result_digest":"sha256:975aa28ef678b0bf924c224431384ded2ade3c60627503747128fc2a9b227557","status":"expected_fail"},{"command_id":"sidecar-test","result_digest":"sha256:52b2ab016d2c1d6993bd403b045e2444b81a428bc63ece19d41ca3acc5ee0b74","status":"pass"},{"command_id":"sub2api-b1-b3-red","result_digest":"sha256:3abe3641a3fcccacb8508e7fe20f73b0befa3a135172bfe0bd9db958ec8e90ad","status":"expected_fail"},{"command_id":"sub2api-test","result_digest":"sha256:c7085c53c0eda805de7fc0281f752e6864c66e22e980601b0322eaeaaa363f2e","status":"pass"}],"command_results_digest":"sha256:22ac4a46760b111cebc3c5fa837229e9dc57b66ffb4c64ba203c3e7dded6e309","context_kind":"post_integration_context","disabled_capabilities":["real_upstream_access","real_credentials","provider_internal_authority","profile_promotion","production_deployment","real_canary","direct_egress_trust","unverified_pinned_wire_claims","unsupported_negative_capabilities","expired_or_missing_negative_capabilities"],"expires_at":"2026-07-13T17:05:07.426Z","generated_at":"2026-07-12T17:05:07.426Z","manifest_digest":"sha256:7670881a6a1d311a1fc47d9be3f7612ed082ebc6a60ccbc89ce100dbae54cb81","next_phase_gates":["phase_0_exit_receipt_valid","fresh_baseline_and_context_required","b1_b6_and_ha_p0_009_remain_non_promotable","real_upstream_credentials_promotion_and_deploy_disabled","named_owner_and_gate_approval_required"],"registry_digest":"sha256:2e212e0fd8cfeec8272178fefc3d952a29f76129e5f1c75b1dd57a95456aada5","repositories":[{"commit":"b38198763ab7e337321e3a0d9e545375d3fb3ad0","name":"cc_gateway","remote_ref":"refs/remotes/muqihang/main"},{"commit":"d5a42bbd24d15af2ce7646d050a5ae5c77911d4f","name":"sub2api","remote_ref":"refs/remotes/muqihang/main"}],"schema_version":1}
