{"claims_digest":"sha256:b389c3655641f990bd7e31e9a176576f9664b7620ae90c5829a21dc9ff087943","command_evidence":[{"command_id":"cc-b4-b6-red","result_digest":"sha256:6fa1e8f29490fc98d0559fb55a5fdbae6f26bf4a868654914fcf3fd52f27709c","status":"expected_fail"},{"command_id":"cc-build","result_digest":"sha256:04995e4e240a8a3839586d84f70c20c76f4d9cdce417bcc83c8414a9620dfb63","status":"pass"},{"command_id":"cc-test","result_digest":"sha256:ae58b8f1c5bd123c7d13a468780de2ded97060defded72c2e96c057c5ac9e154","status":"pass"},{"command_id":"sidecar-b4-b6-red","result_digest":"sha256:97360bdfd1c9f8588966bb305718f3c664158635651e1c52b657a8477e17965f","status":"expected_fail"},{"command_id":"sidecar-test","result_digest":"sha256:df249c0a5acc60637f7d4f5e522bbbed6a3a6133b17008cce7f06a4365d480c0","status":"pass"},{"command_id":"sub2api-b1-b3-red","result_digest":"sha256:70ace14f0fb364e150d56cccdf891f34e051dee87a520acda7601edb46445f60","status":"expected_fail"},{"command_id":"sub2api-test","result_digest":"sha256:d7a51b1f6e1abe456e37fd2e89183f3ab0ac4fad53533031187f96900473d6f2","status":"pass"}],"command_results_digest":"sha256:da945b5e6eff112255e2c8f4843bc3b1e39221c3d7c9d430de508929ccc2abe5","context_kind":"post_integration_context","disabled_capabilities":["real_upstream_access","real_credentials","provider_internal_authority","profile_promotion","production_deployment","real_canary","direct_egress_trust","unverified_pinned_wire_claims","unsupported_negative_capabilities","expired_or_missing_negative_capabilities"],"expires_at":"2026-07-13T15:32:25.787Z","generated_at":"2026-07-12T15:32:25.787Z","manifest_digest":"sha256:a0d1ffedc8fb15dfc209d9c6d14b518e3d567183a047f05aa8df57074bd20bd7","next_phase_gates":["phase_0_exit_receipt_valid","fresh_baseline_and_context_required","b1_b6_and_ha_p0_009_remain_non_promotable","real_upstream_credentials_promotion_and_deploy_disabled","named_owner_and_gate_approval_required"],"registry_digest":"sha256:2e212e0fd8cfeec8272178fefc3d952a29f76129e5f1c75b1dd57a95456aada5","repositories":[{"commit":"414c520f1e06120275c0b4a2f9c6879ba640604e","name":"cc_gateway","remote_ref":"refs/remotes/muqihang/main"},{"commit":"d5a42bbd24d15af2ce7646d050a5ae5c77911d4f","name":"sub2api","remote_ref":"refs/remotes/muqihang/main"}],"schema_version":1}
